{
  "$schema": "http://json-schema.org/draft-07/schema#",
  "$id": "https://github.com/whatsdd/Cybersecurity-companies-Norway/data/schema.json",
  "title": "Company record",
  "description": "One cybersecurity or information security provider in the Norway directory. One file per company, named after its id. Fields holding numbers must always carry a source; unknown facts are omitted or null rather than guessed. `scripts/validate.py` is the authoritative enforcement of these rules.",
  "type": "object",
  "additionalProperties": false,
  "required": [
    "id",
    "name",
    "category",
    "office_in_norway",
    "capabilities",
    "verification",
    "last_verified",
    "sources"
  ],
  "properties": {
    "id": {
      "type": "string",
      "pattern": "^[a-z0-9]+(-[a-z0-9]+)*$",
      "description": "Slug, must match the file name (data/companies/<id>.json)."
    },
    "name": {
      "type": "string",
      "minLength": 2,
      "description": "Name as buyers know it. Keep the name used in the original pentest list so the lineage stays traceable; use `notes` for renames."
    },
    "legal_name": {
      "type": ["string", "null"],
      "description": "Registered legal name of the Norwegian entity, from Enhetsregisteret."
    },
    "website": {
      "type": ["string", "null"],
      "format": "uri",
      "pattern": "^https?://",
      "description": "Official site. Must have been loaded and confirmed to belong to the company."
    },
    "category": {
      "enum": ["norwegian", "nordic", "international"],
      "description": "norwegian = headquartered or registered in Norway; nordic = Nordic group with a Norwegian presence; international = sells to Norway without a Norwegian entity."
    },
    "org_nr": {
      "type": ["string", "null"],
      "pattern": "^[0-9]{9}$",
      "description": "Norwegian organisasjonsnummer for the entity that delivers the Norwegian work. Unique across the dataset, confirmed by a human against Enhetsregisteret, because the registry's name search is fuzzy."
    },
    "office_in_norway": {
      "type": "boolean",
      "description": "True only with a registered Norwegian entity or a Norwegian address published by the company. False means no Norwegian entity was found, never 'no Norwegian staff'."
    },
    "office_cities": {
      "type": "array",
      "items": { "type": "string" },
      "description": "Norwegian cities the company is registered in or publishes as offices."
    },
    "employees_total": {
      "type": ["integer", "null"],
      "minimum": 0,
      "description": "Headcount the company itself states on its own about or careers page. Requires employees_source. This is a whole-company figure, not a count of security staff."
    },
    "employees_source": { "type": ["string", "null"], "format": "uri" },
    "employees_note": {
      "type": ["string", "null"],
      "description": "Qualifier on the figure, e.g. 'stated as 170+' or 'group-wide across the Nordics'."
    },
    "employees_as_of": {
      "type": ["string", "null"],
      "pattern": "^[0-9]{4}-[0-9]{2}-[0-9]{2}$"
    },
    "brreg_employees": {
      "type": ["integer", "null"],
      "minimum": 0,
      "description": "Headcount reported to Enhetsregisteret for this legal entity. It covers the whole entity, including staff who have nothing to do with security, so it is never used as a security staff count. Refreshed by scripts/enrich_brreg.py."
    },
    "brreg_employees_as_of": {
      "type": ["string", "null"],
      "pattern": "^[0-9]{4}-[0-9]{2}-[0-9]{2}$",
      "description": "Registry registration date for the headcount, so staleness is visible."
    },
    "security_staff": {
      "type": ["integer", "null"],
      "minimum": 0,
      "description": "In-house cybersecurity staff: consultants, testers, analysts and engineers on the payroll of the company itself. The most decision-relevant figure in the dataset and the primary ordering signal. Requires security_staff_source and security_staff_basis. Left null when unknown, which is the common case, rather than guessed. Never taken from the registry, and a crowdsourced platform's researcher pool is not staff."
    },
    "security_staff_basis": {
      "enum": ["company-site", "attestation", "estimate", "crowd-platform", null],
      "description": "What kind of claim the number is: company-site = the company publishes it, which is confirmed; attestation = a named person who works there or with them vouches for it first-hand, which is also confirmed but weaker on paper; estimate = the list maintainer's own guarded estimate from market knowledge with nobody standing behind it, so it is labelled estimated everywhere; crowd-platform = a crowdsourced platform's contracted researcher pool, which is not staff. Required whenever security_staff is set."
    },
    "security_staff_is_minimum": {
      "type": ["boolean", "null"],
      "description": "True when the figure is a floor rather than an exact count, e.g. '17+'. Rendered as 17+."
    },
    "security_staff_source": { "type": ["string", "null"], "format": "uri" },
    "security_staff_scope": {
      "enum": ["security-only", "security-and-it", "whole-company", null],
      "description": "What the figure counts when it is not a clean security-only number: security-and-it = the team also does general IT, whole-company = the company states a company-wide figure that includes security staff. Keeps a broad number from reading as a narrow one."
    },
    "security_staff_note": {
      "type": ["string", "null"],
      "description": "What the company does publish instead, e.g. 'publishes 170+ employees and a Red Team service but no staff count'."
    },
    "delivery": {
      "enum": ["in-house", "mixed", "partner-network", "unknown", null],
      "description": "How the Norwegian work is actually delivered: in-house = the company's own employees do it; mixed = mostly own staff with subcontractors for peaks or specialisms; partner-network = there is no real delivery team, work is resold or subcontracted to another provider; unknown = not established. This is the field that separates a provider from a reseller. Requires delivery_source when set."
    },
    "delivery_source": { "type": ["string", "null"], "format": "uri" },
    "delivery_note": {
      "type": ["string", "null"],
      "description": "How the delivery model was established, and anything a reader needs to interpret it."
    },
    "specialty": {
      "type": ["string", "null"],
      "maxLength": 160,
      "description": "One factual line on what this company is actually known for, in plain language, no marketing. Shown as the first line of the capabilities column."
    },
    "capabilities": {
      "type": "array",
      "minItems": 1,
      "description": "The capability tags: what the company itself says it can do. Only add what the company offers, from its own pages. This is the column buyers filter on.",
      "items": {
        "enum": [
          "penetration-testing",
          "red-teaming",
          "purple-teaming",
          "social-engineering",
          "vulnerability-assessment",
          "vulnerability-management",
          "automated-pentesting",
          "attack-surface-management",
          "bug-bounty-platform",
          "crowdsourced-testing",
          "physical-security",
          "crypto-blockchain-audit",
          "application-security",
          "api-security",
          "mobile-security",
          "code-review",
          "secure-development",
          "devsecops",
          "security-architecture",
          "soc",
          "incident-response",
          "threat-intelligence",
          "threat-hunting",
          "digital-forensics",
          "malware-analysis",
          "endpoint-security",
          "network-security",
          "email-security",
          "identity-access-management",
          "pki",
          "data-security",
          "backup-recovery",
          "cloud-security",
          "ot-ics-security",
          "iot-security",
          "container-security",
          "security-audit",
          "compliance",
          "risk-management",
          "privacy-gdpr",
          "nis2-dora",
          "vciso",
          "security-training",
          "awareness-training",
          "tabletop-exercises"
        ]
      }
    },
    "certifications": {
      "type": "array",
      "items": { "type": "string" },
      "description": "Certifications and approvals the company publishes, e.g. ISO 27001, CREST, NSM-approved incident response."
    },
    "founded": { "type": ["string", "null"], "pattern": "^[0-9]{4}-[0-9]{2}-[0-9]{2}$" },
    "former_names": {
      "type": "array",
      "items": { "type": "string" },
      "description": "Rename history from Enhetsregisteret. Omit when the pinned org_nr belongs to an acquiring company rather than the listed one."
    },
    "notes": {
      "type": ["string", "null"],
      "description": "Renames, acquisitions, corrections against the original list, and anything a reader needs to interpret the row."
    },
    "verification": {
      "enum": ["verified", "partial", "unverified"],
      "description": "verified = the facts stated were checked against a primary source; partial = some fields still need confirming (see notes); unverified = no verifiable presence was found."
    },
    "last_verified": {
      "type": "string",
      "pattern": "^[0-9]{4}-[0-9]{2}-[0-9]{2}$",
      "description": "Date a human last checked this row. CI warns after 12 months and fails after 24."
    },
    "verified_by": { "type": ["string", "null"], "description": "Who checked it, e.g. a GitHub handle." },
    "sources": {
      "type": "array",
      "minItems": 1,
      "description": "Evidence. At least one entry per company; every number needs its own.",
      "items": {
        "type": "object",
        "additionalProperties": false,
        "required": ["url", "type", "checked"],
        "properties": {
          "url": { "type": "string", "pattern": "^https?://" },
          "type": {
            "enum": ["registry", "company-site", "news", "seed-list", "attestation", "estimate", "other"],
            "description": "registry = Enhetsregisteret; company-site = the company's own page; news = third-party reporting; seed-list = the original blog list this directory grew out of; attestation = a named person vouches for the claim first-hand, and the note must say who and why they would know; estimate = the maintainer's own guarded estimate from market knowledge rather than a source, and the note must say so."
          },
          "checked": { "type": "string", "pattern": "^[0-9]{4}-[0-9]{2}-[0-9]{2}$" },
          "note": { "type": "string" }
        }
      }
    }
  }
}
