{
  "id": "kpmg-norge",
  "name": "KPMG Norge",
  "legal_name": "KPMG AS",
  "website": "https://www.kpmg.no",
  "category": "norwegian",
  "org_nr": "935174627",
  "office_in_norway": true,
  "office_cities": [
    "Oslo"
  ],
  "brreg_employees": 1373,
  "brreg_employees_as_of": "2026-09-14",
  "delivery": "in-house",
  "delivery_source": "https://www.kpmg.no",
  "delivery_note": "Delivery model recorded from the company's own description of how it staffs the work.",
  "specialty": "Audit and advisory firm with cyber security testing, compliance and crisis support.",
  "capabilities": [
    "penetration-testing",
    "vulnerability-assessment",
    "security-audit",
    "compliance",
    "incident-response",
    "risk-management"
  ],
  "founded": "1984-09-01",
  "former_names": [
    "KPMG PEAT MARWICK AS"
  ],
  "verification": "verified",
  "last_verified": "2026-09-22",
  "verified_by": "@whatsdd",
  "sources": [
    {
      "url": "https://data.brreg.no/enhetsregisteret/api/enheter/935174627",
      "type": "registry",
      "checked": "2026-09-22"
    },
    {
      "url": "https://ahmad.science/2025/05/06/50-selskaper-som-tilbyr-sikkerhetstesting-pentest-i-norge-2025-utgaven/",
      "type": "seed-list",
      "checked": "2026-09-22",
      "note": "2025 edition of the list this directory is based on"
    },
    {
      "url": "https://ahmad.science/2023/02/24/33-pentest-firma-i-norge-sikkerhetstesting-inntrengingstesting/",
      "type": "seed-list",
      "checked": "2026-09-22",
      "note": "original 2023 edition"
    },
    {
      "url": "https://www.kpmg.no",
      "type": "company-site",
      "checked": "2026-09-22"
    }
  ]
}
