{
  "id": "nixu-dnv",
  "name": "DNV Cyber",
  "legal_name": "DNV AS",
  "website": "https://www.dnv.com/cyber/",
  "category": "nordic",
  "org_nr": "945748931",
  "office_in_norway": true,
  "office_cities": [
    "Høvik"
  ],
  "delivery": "in-house",
  "delivery_source": "https://www.dnv.com/cyber/services/",
  "delivery_note": "Delivery model recorded from the company's own description of how it staffs the work.",
  "specialty": "DNV Cyber, which absorbed the Nixu consultancy: IT and OT cyber security services, risk and regulatory work for industry, maritime, energy and defence.",
  "capabilities": [
    "penetration-testing",
    "vulnerability-assessment",
    "soc",
    "incident-response",
    "ot-ics-security",
    "security-audit",
    "compliance",
    "security-training"
  ],
  "notes": "Reported to the list as DNV Cyber AS, and there is no such entity: the cyber business sits in DNV AS (org.nr 945748931, Høvik), which is Norwegian-headquartered, while the brand DNV Cyber was formed when DNV absorbed the Finnish consultancy Nixu. The Nixu Norway AS entity from the 2023 edition no longer resolves in the registry, so DNV AS is the entity pinned here.",
  "verification": "verified",
  "last_verified": "2026-09-22",
  "verified_by": "@whatsdd",
  "sources": [
    {
      "url": "https://ahmad.science/2025/05/06/50-selskaper-som-tilbyr-sikkerhetstesting-pentest-i-norge-2025-utgaven/",
      "type": "seed-list",
      "checked": "2026-09-22",
      "note": "2025 edition of the list this directory is based on"
    },
    {
      "url": "https://ahmad.science/2023/02/24/33-pentest-firma-i-norge-sikkerhetstesting-inntrengingstesting/",
      "type": "seed-list",
      "checked": "2026-09-22",
      "note": "original 2023 edition"
    },
    {
      "url": "https://www.dnv.com/cyber/services/",
      "type": "company-site",
      "checked": "2026-09-22",
      "note": "Publishes IT and OT cyber security services, risk identification and prioritisation, and regulatory guidance"
    },
    {
      "url": "https://www.dnv.com/cyber/",
      "type": "company-site",
      "checked": "2026-09-22",
      "note": "DNV Cyber as the group's cyber security business, including national security and defence, and maritime cyber security"
    },
    {
      "url": "https://data.brreg.no/enhetsregisteret/api/enheter/945748931",
      "type": "registry",
      "checked": "2026-09-22"
    }
  ],
  "brreg_employees": 2341,
  "brreg_employees_as_of": "2026-09-14",
  "founded": "1988-01-01",
  "former_names": [
    "Det norske Veritas Classification A/S",
    "DET NORSKE VERITAS AS",
    "DNV GL AS"
  ]
}
