{
  "id": "breachlock",
  "name": "BreachLock",
  "website": "https://www.breachlock.com",
  "category": "international",
  "office_in_norway": false,
  "office_cities": [],
  "delivery": "in-house",
  "delivery_source": "https://www.breachlock.com",
  "delivery_note": "Delivery model recorded from the company's own description of how it staffs the work.",
  "specialty": "Penetration testing as a service with a platform-backed delivery model.",
  "capabilities": [
    "penetration-testing",
    "vulnerability-assessment",
    "attack-surface-management"
  ],
  "notes": "No Norwegian entity registered; serves Norwegian customers remotely.",
  "verification": "verified",
  "last_verified": "2026-09-22",
  "verified_by": "@whatsdd",
  "sources": [
    {
      "url": "https://ahmad.science/2025/05/06/50-selskaper-som-tilbyr-sikkerhetstesting-pentest-i-norge-2025-utgaven/",
      "type": "seed-list",
      "checked": "2026-09-22",
      "note": "2025 edition of the list this directory is based on"
    },
    {
      "url": "https://ahmad.science/2023/02/24/33-pentest-firma-i-norge-sikkerhetstesting-inntrengingstesting/",
      "type": "seed-list",
      "checked": "2026-09-22",
      "note": "original 2023 edition"
    },
    {
      "url": "https://www.breachlock.com",
      "type": "company-site",
      "checked": "2026-09-22"
    }
  ]
}
