{
  "id": "telenor-cyberdefence",
  "name": "Telenor Cyberdefence",
  "legal_name": "TELENOR CYBERDEFENCE AS",
  "website": "https://www.telenorcyberdefence.com",
  "category": "norwegian",
  "org_nr": "932975424",
  "office_in_norway": true,
  "office_cities": [
    "Fornebu"
  ],
  "security_staff": 88,
  "security_staff_basis": "estimate",
  "security_staff_is_minimum": true,
  "security_staff_scope": "whole-company",
  "security_staff_source": "https://github.com/whatsdd/Cybersecurity-companies-Norway/blob/main/docs/methodology.md#guarded-estimates",
  "security_staff_note": "Guarded estimate by the list maintainer (@whatsdd) and not published by the company: the headcount this entity filed with Enhetsregisteret, which is a security-only business, so the whole payroll is security work. It is the entity's headcount rather than a measured split, which is why it is an estimate and a floor.",
  "brreg_employees": 88,
  "brreg_employees_as_of": "2026-09-14",
  "delivery": "in-house",
  "delivery_source": "https://www.telenorcyberdefence.com",
  "delivery_note": "Delivery model recorded from the company's own description of how it staffs the work.",
  "specialty": "Telenor's security company: 24/7 SOC, incident response, testing and threat intelligence.",
  "capabilities": [
    "soc",
    "incident-response",
    "threat-intelligence",
    "penetration-testing",
    "red-teaming",
    "vulnerability-assessment",
    "ot-ics-security",
    "tabletop-exercises"
  ],
  "founded": "2024-01-01",
  "former_names": [
    "NFH 240157 AS",
    "TELENOR CYBERDEFENSE AS"
  ],
  "notes": "Listed as \"Watchcom (now Telenor Cyberdefence)\". Telenor acquired Watchcom, and this entity carries the rename history TELENOR CYBERDEFENSE AS -> TELENOR CYBERDEFENCE AS.",
  "verification": "verified",
  "last_verified": "2026-09-22",
  "verified_by": "@whatsdd",
  "sources": [
    {
      "url": "https://data.brreg.no/enhetsregisteret/api/enheter/932975424",
      "type": "registry",
      "checked": "2026-09-22"
    },
    {
      "url": "https://ahmad.science/2025/05/06/50-selskaper-som-tilbyr-sikkerhetstesting-pentest-i-norge-2025-utgaven/",
      "type": "seed-list",
      "checked": "2026-09-22",
      "note": "2025 edition of the list this directory is based on"
    },
    {
      "url": "https://ahmad.science/2023/02/24/33-pentest-firma-i-norge-sikkerhetstesting-inntrengingstesting/",
      "type": "seed-list",
      "checked": "2026-09-22",
      "note": "original 2023 edition"
    },
    {
      "url": "https://www.telenorcyberdefence.com",
      "type": "company-site",
      "checked": "2026-09-22"
    },
    {
      "url": "https://github.com/whatsdd/Cybersecurity-companies-Norway/blob/main/docs/methodology.md#guarded-estimates",
      "type": "estimate",
      "checked": "2026-09-22",
      "note": "Guarded estimate by the list maintainer (@whatsdd) and not published by the company: the headcount this entity filed with Enhetsregisteret, which is a security-only business, so the whole payroll is security work. It is the entity's headcount rather than a measured split, which is why it is an estimate and a floor."
    }
  ]
}
