{
  "id": "ey-norge",
  "name": "EY Norge",
  "legal_name": "ERNST & YOUNG AS",
  "website": "https://www.ey.com/no_no",
  "category": "norwegian",
  "org_nr": "976389387",
  "office_in_norway": true,
  "office_cities": [
    "Oslo"
  ],
  "security_staff": 10,
  "security_staff_basis": "estimate",
  "security_staff_is_minimum": true,
  "security_staff_source": "https://github.com/whatsdd/Cybersecurity-companies-Norway/blob/main/docs/methodology.md#guarded-estimates",
  "security_staff_note": "In-house security staff: 10 or more. Estimated by the list maintainer, not published by the company.",
  "brreg_employees": 1422,
  "brreg_employees_as_of": "2026-09-14",
  "delivery": "in-house",
  "delivery_source": "https://www.ey.com/no_no",
  "delivery_note": "Delivery model recorded from the company's own description of how it staffs the work.",
  "specialty": "Audit and advisory giant whose Norwegian cyber team covers testing, resilience and compliance.",
  "capabilities": [
    "penetration-testing",
    "vulnerability-assessment",
    "security-audit",
    "compliance",
    "risk-management",
    "incident-response",
    "cloud-security"
  ],
  "founded": "1996-03-28",
  "former_names": [
    "ERNST & YOUNG MANAGEMENT CONSULTING AS"
  ],
  "notes": "The in-house security staff figure is an estimate by the list author and is not published on the company site. EY is a large multi-service firm, so this figure is a fraction of its Norwegian headcount.",
  "verification": "verified",
  "last_verified": "2026-09-22",
  "verified_by": "@whatsdd",
  "sources": [
    {
      "url": "https://data.brreg.no/enhetsregisteret/api/enheter/976389387",
      "type": "registry",
      "checked": "2026-09-22"
    },
    {
      "url": "https://ahmad.science/2025/05/06/50-selskaper-som-tilbyr-sikkerhetstesting-pentest-i-norge-2025-utgaven/",
      "type": "seed-list",
      "checked": "2026-09-22",
      "note": "2025 edition of the list this directory is based on"
    },
    {
      "url": "https://ahmad.science/2023/02/24/33-pentest-firma-i-norge-sikkerhetstesting-inntrengingstesting/",
      "type": "seed-list",
      "checked": "2026-09-22",
      "note": "original 2023 edition"
    },
    {
      "url": "https://www.ey.com/no_no",
      "type": "company-site",
      "checked": "2026-09-22"
    },
    {
      "url": "https://github.com/whatsdd/Cybersecurity-companies-Norway/blob/main/docs/methodology.md#guarded-estimates",
      "type": "estimate",
      "checked": "2026-09-22",
      "note": "Estimated by the list maintainer (Ahmad Abdur Rehman) from market knowledge. EY publishes no security staff count, so this is a guarded estimate, labelled as one everywhere it appears."
    }
  ]
}
