{
  "id": "cobalt",
  "name": "Cobalt",
  "website": "https://www.cobalt.io",
  "category": "international",
  "office_in_norway": false,
  "office_cities": [],
  "delivery": "partner-network",
  "delivery_source": "https://www.cobalt.io",
  "delivery_note": "The company's own materials describe work being resold or subcontracted rather than staffed from its own payroll.",
  "specialty": "Pentest as a service platform with a vetted tester pool and orchestration.",
  "capabilities": [
    "penetration-testing",
    "red-teaming",
    "crowdsourced-testing",
    "vulnerability-assessment",
    "automated-pentesting"
  ],
  "certifications": [
    "ISO 27001"
  ],
  "notes": "Cobalt (cobalt.io) is a crowdsourced pentest platform with no Norwegian entity. Note that an unrelated Norwegian company, COBALT AS (org.nr 924359005, Oslo), shares the name and must not be confused with it.",
  "verification": "verified",
  "last_verified": "2026-09-22",
  "verified_by": "@whatsdd",
  "sources": [
    {
      "url": "https://ahmad.science/2025/05/06/50-selskaper-som-tilbyr-sikkerhetstesting-pentest-i-norge-2025-utgaven/",
      "type": "seed-list",
      "checked": "2026-09-22",
      "note": "2025 edition of the list this directory is based on"
    },
    {
      "url": "https://ahmad.science/2023/02/24/33-pentest-firma-i-norge-sikkerhetstesting-inntrengingstesting/",
      "type": "seed-list",
      "checked": "2026-09-22",
      "note": "original 2023 edition"
    },
    {
      "url": "https://www.cobalt.io",
      "type": "company-site",
      "checked": "2026-09-22"
    }
  ]
}
