{
  "id": "fencenordic",
  "name": "Fencenordic",
  "legal_name": "FENCE AS",
  "website": "https://fence.no",
  "category": "norwegian",
  "org_nr": "934279220",
  "office_in_norway": true,
  "office_cities": [
    "Oslo"
  ],
  "security_staff": 11,
  "security_staff_basis": "estimate",
  "security_staff_is_minimum": true,
  "security_staff_scope": "whole-company",
  "security_staff_source": "https://github.com/whatsdd/Cybersecurity-companies-Norway/blob/main/docs/methodology.md#guarded-estimates",
  "security_staff_note": "Guarded estimate by the list maintainer (@whatsdd) and not published by the company: the headcount this entity filed with Enhetsregisteret, which is a security-only business, so the whole payroll is security work. It is the entity's headcount rather than a measured split, which is why it is an estimate and a floor.",
  "brreg_employees": 11,
  "brreg_employees_as_of": "2026-07-15",
  "delivery": "in-house",
  "delivery_source": "https://fence.no",
  "delivery_note": "Delivery model recorded from the company's own description of how it staffs the work.",
  "specialty": "Norwegian MDR provider: 24/7 monitoring, incident response and managed detection.",
  "capabilities": [
    "soc",
    "incident-response",
    "penetration-testing",
    "red-teaming",
    "vulnerability-management",
    "threat-intelligence",
    "endpoint-security",
    "security-training"
  ],
  "certifications": [
    "NSM-approved incident response team"
  ],
  "founded": "2024-09-23",
  "former_names": [
    "FENCE DRIFT AS"
  ],
  "notes": "Listed as \"Fencenordic\"; the company now operates as Fence and this entity is the Norwegian legal entity (formerly FENCE DRIFT AS).",
  "verification": "verified",
  "last_verified": "2026-09-22",
  "verified_by": "@whatsdd",
  "sources": [
    {
      "url": "https://data.brreg.no/enhetsregisteret/api/enheter/934279220",
      "type": "registry",
      "checked": "2026-09-22"
    },
    {
      "url": "https://ahmad.science/2025/05/06/50-selskaper-som-tilbyr-sikkerhetstesting-pentest-i-norge-2025-utgaven/",
      "type": "seed-list",
      "checked": "2026-09-22",
      "note": "2025 edition of the list this directory is based on"
    },
    {
      "url": "https://ahmad.science/2023/02/24/33-pentest-firma-i-norge-sikkerhetstesting-inntrengingstesting/",
      "type": "seed-list",
      "checked": "2026-09-22",
      "note": "original 2023 edition"
    },
    {
      "url": "https://fence.no",
      "type": "company-site",
      "checked": "2026-09-22"
    },
    {
      "url": "https://github.com/whatsdd/Cybersecurity-companies-Norway/blob/main/docs/methodology.md#guarded-estimates",
      "type": "estimate",
      "checked": "2026-09-22",
      "note": "Guarded estimate by the list maintainer (@whatsdd) and not published by the company: the headcount this entity filed with Enhetsregisteret, which is a security-only business, so the whole payroll is security work. It is the entity's headcount rather than a measured split, which is why it is an estimate and a floor."
    }
  ]
}
